date	commit	status	key_indicators	description
2026-04-16	working	tree-green	REQ-026 tested; go build/vet/test green	Implemented worker HTTP client loop with launcher execution, heartbeat, lifecycle contract test, and reconnect test
2026-04-16	working	keep	go_test=pass; req_007=tested; docs=updated	Implemented GitHub Actions remote runner adapter, mocked API integration test, and example workflow/docs for REQ-007.
2026-04-16	working	keep	go_test=pass; go_build=pass; go_vet=pass; req_007=tested	Hardened REQ-007 by binding to the exact dispatched Actions run ID, requiring a downloaded session artifact, and extending mocked GHA integration coverage for both behaviors.
2026-04-16	uncommitted	keep	go build=pass; go vet=pass; go test=pass; index-validate=missing-script	REQ-027 standalone coordinator command with worker HTTP API, bearer auth, and smoke coverage
2026-04-16	uncommitted	keep	cmd tests=pass; workerclient tests=pass; shutdown-requeue=pass	REQ-028 standalone worker command with authenticated worker client, synthetic coordinator smoke test, invalid-token diagnostics, and graceful shutdown requeue
2026-04-16	working	tree-cleanup-recover	in_progress	Implement REQ-032 recover command, tests, and index update
2026-04-16	HEAD	keep	pass	REQ-032 shipped with recover command, focused integration tests, and green build/vet/test
2026-04-16	uncommitted	keep	cmd tests=pass; multi_repo tests=pass; full build/vet/test pending	REQ-042 multi-repo dynamic registration with per-repo runtimes, worker repo binding, repo register CLI, and deregistration coverage
